<?xml version="1.0" standalone="no"?>
<!DOCTYPE crossway-bible SYSTEM "schema/crossway.bibles.dtd">
<crossway-bible translation="English Standard Version" revision="2025-02-02" xmlns="http://www.crosswaybibles.org" xmlns:xsi="http://www.w3.org/2001/XMLSchema-instance" xsi:schemaLocation="schema/crossway.bibles.xsd">
<book title="Jude" num="65">
  <marker class="begin-verse" mid="v65001001"/>
  <chapter num="1">
    <heading>Greeting</heading>
    <begin-paragraph/>
    <verse num="1">Jude, a servant<note nid="n65001001.1"/> of Jesus Christ and brother of James,
      <end-paragraph/>
      <begin-paragraph/><crossref let="a" cid="c65001001.1"/>To those who are called, <crossref let="b" cid="c65001001.2"/>beloved in God the Father and <crossref let="c" cid="c65001001.3"/>kept for<note nid="n65001001.2"/> Jesus Christ:
    </verse>
    <end-paragraph/>
    <marker class="begin-verse" mid="v65001002"/>
    <begin-paragraph/>
    <verse num="2">May <crossref let="d" cid="c65001002.1"/>mercy, <crossref let="e" cid="c65001002.2"/>peace, and love be multiplied to you.</verse>
    <end-paragraph/>
    <marker class="begin-verse" mid="v65001003"/>
    <heading>Judgment on False Teachers</heading>
    <begin-paragraph/>
    <verse num="3">Beloved, although I was very eager to write to you about our <crossref let="f" cid="c65001003.1"/>common salvation, I found it necessary to write appealing to you <crossref let="g" cid="c65001003.2"/>to contend for the faith that was once for all delivered to the saints.</verse>
    <marker class="begin-verse" mid="v65001004"/>
    <verse num="4">For <crossref let="h" cid="c65001004.1"/>certain people <crossref let="i" cid="c65001004.2"/>have crept in unnoticed <crossref let="j" cid="c65001004.3"/>who long ago were designated for this condemnation, ungodly people, who pervert <crossref let="k" cid="c65001004.4"/>the grace of our God into sensuality and <crossref let="l" cid="c65001004.5"/>deny our only Master and Lord, Jesus Christ.</verse>
    <end-paragraph/>
    <marker class="begin-verse" mid="v65001005"/>
    <begin-paragraph/>
    <verse num="5">Now I want <crossref let="m" cid="c65001005.1"/>to remind you, although you once fully knew it, that <crossref let="n" cid="c65001005.2"/>Jesus, who saved<note nid="n65001005.1"/> a people out of the land of Egypt, <crossref let="o" cid="c65001005.3"/>afterward destroyed those who did not believe.</verse>
    <marker class="begin-verse" mid="v65001006"/>
    <verse num="6">And <crossref let="p" cid="c65001006.1"/>the angels who did not stay within their own position of authority, but left their proper dwelling, he has kept in eternal chains under gloomy darkness until the judgment of the great day&emdash;</verse>
    <marker class="begin-verse" mid="v65001007"/>
    <verse num="7">just as <crossref let="q" cid="c65001007.1"/>Sodom and Gomorrah and <crossref let="r" cid="c65001007.2"/>the surrounding cities, which likewise indulged in sexual immorality and <crossref let="s" cid="c65001007.3"/>pursued unnatural desire,<note nid="n65001007.1"/> serve as an example by undergoing a punishment of eternal fire.</verse>
    <end-paragraph/>
    <marker class="begin-verse" mid="v65001008"/>
    <begin-paragraph/>
    <verse num="8">Yet in like manner these people also, relying on their dreams, defile the flesh, reject authority, and <crossref let="t" cid="c65001008.1"/>blaspheme the glorious ones.</verse>
    <marker class="begin-verse" mid="v65001009"/>
    <verse num="9">But when <crossref let="u" cid="c65001009.1"/>the archangel <crossref let="v" cid="c65001009.2"/>Michael, contending with the devil, was disputing <crossref let="w" cid="c65001009.3"/>about the body of Moses, he did not presume to pronounce a blasphemous judgment, but said, <crossref let="x" cid="c65001009.4"/><q class="begin-double" qid="65001009.1" from="65001009.1" to="65001009.2"/>The Lord rebuke you.<q class="end-double" qid="65001009.2" from="65001009.1" to="65001009.2"/></verse>
    <marker class="begin-verse" mid="v65001010"/>
    <verse num="10"><crossref let="y" cid="c65001010.1"/>But these people blaspheme all that they do not understand, and they are destroyed by all that they, like unreasoning animals, understand instinctively.</verse>
    <marker class="begin-verse" mid="v65001011"/>
    <verse num="11">Woe to them! For they walked in <crossref let="z" cid="c65001011.1"/>the way of Cain and abandoned themselves for the sake of gain <crossref let="a" cid="c65001011.2"/>to Balaam&apos;s error and <crossref let="b" cid="c65001011.3"/>perished in Korah&apos;s rebellion.</verse>
    <marker class="begin-verse" mid="v65001012"/>
    <verse num="12">These are hidden reefs<note nid="n65001012.1"/> <crossref let="c" cid="c65001012.1"/>at your love feasts, as they feast with you without fear, <crossref let="d" cid="c65001012.2"/>shepherds feeding themselves; <crossref let="e" cid="c65001012.3"/>waterless clouds, <crossref let="f" cid="c65001012.4"/>swept along by winds; fruitless trees in late autumn, twice dead, <crossref let="g" cid="c65001012.5"/>uprooted;</verse>
    <marker class="begin-verse" mid="v65001013"/>
    <verse num="13"><crossref let="h" cid="c65001013.1"/>wild waves of the sea, casting up the foam of <crossref let="i" cid="c65001013.2"/>their own shame; <crossref let="j" cid="c65001013.3"/>wandering stars, <crossref let="k" cid="c65001013.4"/>for whom the gloom of utter darkness has been reserved forever.</verse>
    <end-paragraph/>
    <marker class="begin-verse" mid="v65001014"/>
    <begin-paragraph/>
    <verse num="14">It was also about these that Enoch, <crossref let="l" cid="c65001014.1"/>the seventh from Adam, prophesied, saying, <crossref let="m" cid="c65001014.2"/><q class="begin-double" qid="65001014.1" from="65001014.1" to="65001015.1"/>Behold, the Lord comes with ten thousands of his holy ones,</verse>
    <marker class="begin-verse" mid="v65001015"/>
    <verse num="15"><crossref let="n" cid="c65001015.1"/>to execute judgment on all and to convict all the ungodly of all their deeds of ungodliness that they have <crossref let="o" cid="c65001015.2"/>committed in such an ungodly way, and of all <crossref let="p" cid="c65001015.3"/>the harsh things that ungodly sinners have spoken against him.<q class="end-double" qid="65001015.1" from="65001014.1" to="65001015.1"/></verse>
    <marker class="begin-verse" mid="v65001016"/>
    <verse num="16">These are grumblers, malcontents, <crossref let="q" cid="c65001016.1"/>following their own sinful desires; <crossref let="r" cid="c65001016.2"/>they are loud-mouthed boasters, <crossref let="s" cid="c65001016.3"/>showing favoritism to gain advantage.</verse>
    <end-paragraph/>
    <marker class="begin-verse" mid="v65001017"/>
    <heading>A Call to Persevere</heading>
    <begin-paragraph/>
    <verse num="17">But you must <crossref let="t" cid="c65001017.1"/>remember, beloved, the predictions of the apostles of our Lord Jesus Christ.</verse>
    <marker class="begin-verse" mid="v65001018"/>
    <verse num="18">They<note nid="n65001018.1"/> said to you, <crossref let="u" cid="c65001018.1"/><q class="begin-double" qid="65001018.1" from="65001018.1" to="65001018.2"/>In the last time there will be scoffers, following their own ungodly passions.<q class="end-double" qid="65001018.2" from="65001018.1" to="65001018.2"/></verse>
    <marker class="begin-verse" mid="v65001019"/>
    <verse num="19">It is these who cause divisions, worldly people, <crossref let="v" cid="c65001019.1"/>devoid of the Spirit.</verse>
    <marker class="begin-verse" mid="v65001020"/>
    <verse num="20">But you, beloved, <crossref let="w" cid="c65001020.1"/>building yourselves up in your most holy faith and <crossref let="x" cid="c65001020.2"/>praying in the Holy Spirit,</verse>
    <marker class="begin-verse" mid="v65001021"/>
    <verse num="21"><crossref let="y" cid="c65001021.1"/>keep yourselves in the love of God, <crossref let="z" cid="c65001021.2"/>waiting for the mercy of our Lord Jesus Christ that leads to eternal life.</verse>
    <marker class="begin-verse" mid="v65001022"/>
    <verse num="22">And have mercy on those who doubt;</verse>
    <marker class="begin-verse" mid="v65001023"/>
    <verse num="23">save others by <crossref let="a" cid="c65001023.1"/>snatching them out of <crossref let="b" cid="c65001023.2"/>the fire; to others show mercy <crossref let="c" cid="c65001023.3"/>with fear, hating even <crossref let="d" cid="c65001023.4"/>the garment<note nid="n65001023.1"/> stained by the flesh.</verse>
    <end-paragraph/>
    <marker class="begin-verse" mid="v65001024"/>
    <heading>Doxology</heading>
    <begin-paragraph/>
    <verse num="24"><crossref let="e" cid="c65001024.1"/>Now to him who is able <crossref let="f" cid="c65001024.2"/>to keep you from stumbling and <crossref let="g" cid="c65001024.3"/>to present you <crossref let="h" cid="c65001024.4"/>blameless before the presence of his glory with great joy,</verse>
    <marker class="begin-verse" mid="v65001025"/>
    <verse num="25">to <crossref let="i" cid="c65001025.1"/>the only God, our Savior, through Jesus Christ our Lord, <crossref let="j" cid="c65001025.2"/>be glory, majesty, dominion, and authority, before all time<note nid="n65001025.1"/> and now and forever. Amen.</verse>
    <end-paragraph/>
  </chapter>
</book>
</crossway-bible>
