<?xml version="1.0" standalone="no"?>
<!DOCTYPE crossway-bible SYSTEM "schema/crossway.bibles.dtd">
<crossway-bible translation="English Standard Version" revision="2025-02-02" xmlns="http://www.crosswaybibles.org" xmlns:xsi="http://www.w3.org/2001/XMLSchema-instance" xsi:schemaLocation="schema/crossway.bibles.xsd">
<book title="3 John" num="64">
  <marker class="begin-verse" mid="v64001001"/>
  <chapter num="1">
    <heading>Greeting</heading>
    <begin-paragraph/>
    <verse num="1"><crossref let="a" cid="c64001001.1"/>The elder to the beloved Gaius, <crossref let="b" cid="c64001001.2"/>whom I love in truth.</verse>
    <end-paragraph/>
    <marker class="begin-verse" mid="v64001002"/>
    <begin-paragraph/>
    <verse num="2">Beloved, I pray that all may go well with you and that you may be in good health, as it goes well with your soul.</verse>
    <marker class="begin-verse" mid="v64001003"/>
    <verse num="3">For <crossref let="c" cid="c64001003.1"/>I rejoiced greatly when the brothers<note nid="n64001003.1"/> came and testified to your truth, as indeed you are walking in the truth.</verse>
    <marker class="begin-verse" mid="v64001004"/>
    <verse num="4">I have no greater joy than to hear that <crossref let="d" cid="c64001004.1"/>my children are walking in the truth.</verse>
    <end-paragraph/>
    <marker class="begin-verse" mid="v64001005"/>
    <heading>Support and Opposition</heading>
    <begin-paragraph/>
    <verse num="5">Beloved, it is a faithful thing you do in all your efforts for <crossref let="e" cid="c64001005.1"/>these brothers, <crossref let="f" cid="c64001005.2"/>strangers as they are,</verse>
    <marker class="begin-verse" mid="v64001006"/>
    <verse num="6">who testified to your love before the church. You will do well to send them on their journey in a manner <crossref let="g" cid="c64001006.1"/>worthy of God.</verse>
    <marker class="begin-verse" mid="v64001007"/>
    <verse num="7">For they have gone out for the sake of <crossref let="h" cid="c64001007.1"/>the name, <crossref let="i" cid="c64001007.2"/>accepting nothing from the Gentiles.</verse>
    <marker class="begin-verse" mid="v64001008"/>
    <verse num="8">Therefore we ought to support people like these, that we may be fellow workers for the truth.</verse>
    <end-paragraph/>
    <marker class="begin-verse" mid="v64001009"/>
    <begin-paragraph/>
    <verse num="9">I have written something to the church, but Diotrephes, who likes to put himself first, does not acknowledge our authority.</verse>
    <marker class="begin-verse" mid="v64001010"/>
    <verse num="10">So if I come, I will bring up what he is doing, talking wicked nonsense against us. And not content with that, he refuses to welcome the brothers, and also stops those who want to and puts them out of the church.</verse>
    <end-paragraph/>
    <marker class="begin-verse" mid="v64001011"/>
    <begin-paragraph/>
    <verse num="11">Beloved, <crossref let="j" cid="c64001011.1"/>do not imitate evil but imitate good. <crossref let="k" cid="c64001011.2"/>Whoever does good is from God; <crossref let="l" cid="c64001011.3"/>whoever does evil has not seen God.</verse>
    <marker class="begin-verse" mid="v64001012"/>
    <verse num="12">Demetrius <crossref let="m" cid="c64001012.1"/>has received a good testimony from everyone, and from the truth itself. We also add our testimony, and <crossref let="n" cid="c64001012.2"/>you know that our testimony is true.</verse>
    <end-paragraph/>
    <marker class="begin-verse" mid="v64001013"/>
    <heading>Final Greetings</heading>
    <begin-paragraph/>
    <verse num="13"><crossref let="o" cid="c64001013.1"/>I had much to write to you, but I would rather not write with pen and ink.</verse>
    <marker class="begin-verse" mid="v64001014"/>
    <verse num="14">I hope to see you soon, and we will talk face to face.</verse>
    <end-paragraph/>
    <marker class="begin-verse" mid="v64001015"/>
    <begin-paragraph/>
    <verse num="15">Peace be to you. The friends greet you. Greet the friends, <crossref let="p" cid="c64001015.1"/>each by name.</verse>
    <end-paragraph/>
  </chapter>
</book>
</crossway-bible>
