<?xml version="1.0" standalone="no"?>
<!DOCTYPE crossway-bible SYSTEM "schema/crossway.bibles.dtd">
<crossway-bible translation="English Standard Version" revision="2025-02-02" xmlns="http://www.crosswaybibles.org" xmlns:xsi="http://www.w3.org/2001/XMLSchema-instance" xsi:schemaLocation="schema/crossway.bibles.xsd">
<book title="2 John" num="63">
  <marker class="begin-verse" mid="v63001001"/>
  <chapter num="1">
    <heading>Greeting</heading>
    <begin-paragraph/>
    <verse num="1"><crossref let="a" cid="c63001001.1"/>The elder to the elect lady and her children, <crossref let="b" cid="c63001001.2"/>whom I love in truth, and not only I, but also all who <crossref let="c" cid="c63001001.3"/>know <crossref let="d" cid="c63001001.4"/>the truth,</verse>
    <marker class="begin-verse" mid="v63001002"/>
    <verse num="2"><crossref let="e" cid="c63001002.1"/>because of the truth that abides in us and will be with us forever:</verse>
    <end-paragraph/>
    <marker class="begin-verse" mid="v63001003"/>
    <begin-paragraph/>
    <verse num="3"><crossref let="f" cid="c63001003.1"/>Grace, mercy, and peace will be with us, from God the Father and from Jesus Christ the Father&apos;s Son, in truth and love.</verse>
    <end-paragraph/>
    <marker class="begin-verse" mid="v63001004"/>
    <heading>Walking in Truth and Love</heading>
    <begin-paragraph/>
    <verse num="4"><crossref let="g" cid="c63001004.1"/>I rejoiced greatly to find some of your children walking in the truth, just as we were commanded by the Father.</verse>
    <marker class="begin-verse" mid="v63001005"/>
    <verse num="5">And now I ask you, dear lady&emdash;<crossref let="h" cid="c63001005.1"/>not as though I were writing you a new commandment, but the one we have had from the beginning&emdash;<crossref let="i" cid="c63001005.2"/>that we love one another.</verse>
    <marker class="begin-verse" mid="v63001006"/>
    <verse num="6">And <crossref let="j" cid="c63001006.1"/>this is love, that we walk according to his commandments; this is the commandment, just <crossref let="k" cid="c63001006.2"/>as you have heard from the beginning, so that you should walk in it.</verse>
    <marker class="begin-verse" mid="v63001007"/>
    <verse num="7">For <crossref let="l" cid="c63001007.1"/>many deceivers <crossref let="m" cid="c63001007.2"/>have gone out into the world, <crossref let="n" cid="c63001007.3"/>those who do not confess the coming of Jesus Christ in the flesh. Such a one is the deceiver and the antichrist.</verse>
    <marker class="begin-verse" mid="v63001008"/>
    <verse num="8">Watch yourselves, <crossref let="o" cid="c63001008.1"/>so that you may not lose what we<note nid="n63001008.1"/> have worked for, but <crossref let="p" cid="c63001008.2"/>may win a full reward.</verse>
    <marker class="begin-verse" mid="v63001009"/>
    <verse num="9">Everyone who goes on ahead and does not abide in the teaching of Christ, <crossref let="q" cid="c63001009.1"/>does not have God. Whoever abides in the teaching <crossref let="q" cid="c63001009.2"/>has both the Father and the Son.</verse>
    <marker class="begin-verse" mid="v63001010"/>
    <verse num="10">If anyone comes to you and does not bring this teaching, <crossref let="r" cid="c63001010.1"/>do not receive him into your house or give him any greeting,</verse>
    <marker class="begin-verse" mid="v63001011"/>
    <verse num="11">for whoever greets him <crossref let="s" cid="c63001011.1"/>takes part in his wicked works.</verse>
    <end-paragraph/>
    <marker class="begin-verse" mid="v63001012"/>
    <heading>Final Greetings</heading>
    <begin-paragraph/>
    <verse num="12"><crossref let="t" cid="c63001012.1"/>Though I have much to write to you, I would rather not use paper and ink. <crossref let="u" cid="c63001012.2"/>Instead I hope to come to you and talk face to face, <crossref let="v" cid="c63001012.3"/>so that our joy may be complete.</verse>
    <end-paragraph/>
    <marker class="begin-verse" mid="v63001013"/>
    <begin-paragraph/>
    <verse num="13">The children of your elect sister greet you.</verse>
    <end-paragraph/>
  </chapter>
</book>
</crossway-bible>
