<?xml version="1.0" standalone="no"?>
<!DOCTYPE crossway-bible SYSTEM "schema/crossway.bibles.dtd">
<crossway-bible translation="English Standard Version" revision="2025-02-02" xmlns="http://www.crosswaybibles.org" xmlns:xsi="http://www.w3.org/2001/XMLSchema-instance" xsi:schemaLocation="schema/crossway.bibles.xsd">
<book title="Philemon" num="57">
  <marker class="begin-verse" mid="v57001001"/>
  <chapter num="1">
    <heading>Greeting</heading>
    <begin-paragraph/>
    <verse num="1">Paul, <crossref let="a" cid="c57001001.1"/>a prisoner for Christ Jesus, and <crossref let="b" cid="c57001001.2"/>Timothy our brother,
      <end-paragraph/>
      <begin-paragraph/>To Philemon our beloved fellow worker
    </verse>
    <marker class="begin-verse" mid="v57001002"/>
    <verse num="2">and Apphia our sister and <crossref let="c" cid="c57001002.1"/>Archippus our <crossref let="d" cid="c57001002.2"/>fellow soldier, and <crossref let="e" cid="c57001002.3"/>the church in your house:</verse>
    <end-paragraph/>
    <marker class="begin-verse" mid="v57001003"/>
    <begin-paragraph/>
    <verse num="3"><crossref let="f" cid="c57001003.1"/>Grace to you and peace from God our Father and the Lord Jesus Christ.</verse>
    <end-paragraph/>
    <marker class="begin-verse" mid="v57001004"/>
    <heading>Philemon&apos;s Love and Faith</heading>
    <begin-paragraph/>
    <verse num="4"><crossref let="g" cid="c57001004.1"/>I thank my God always when I remember you in my prayers,</verse>
    <marker class="begin-verse" mid="v57001005"/>
    <verse num="5">because I <crossref let="h" cid="c57001005.1"/>hear of your love and <crossref let="i" cid="c57001005.2"/>of the faith that you have toward the Lord Jesus and for all the saints,</verse>
    <marker class="begin-verse" mid="v57001006"/>
    <verse num="6">and I pray that the sharing of your faith may become effective for the full <crossref let="j" cid="c57001006.1"/>knowledge of every good thing that is in us for the sake of Christ.<note nid="n57001006.1"/></verse>
    <marker class="begin-verse" mid="v57001007"/>
    <verse num="7">For I have derived much joy and <crossref let="k" cid="c57001007.1"/>comfort from your love, my brother, because the hearts of the saints <crossref let="l" cid="c57001007.2"/>have been refreshed through you.</verse>
    <end-paragraph/>
    <marker class="begin-verse" mid="v57001008"/>
    <heading>Paul&apos;s Plea for Onesimus</heading>
    <begin-paragraph/>
    <verse num="8">Accordingly, <crossref let="m" cid="c57001008.1"/>though I am bold enough in Christ to command you to do <crossref let="n" cid="c57001008.2"/>what is required,</verse>
    <marker class="begin-verse" mid="v57001009"/>
    <verse num="9">yet for love&apos;s sake I prefer to appeal to you&emdash;I, Paul, an old man and now <crossref let="o" cid="c57001009.1"/>a prisoner also for Christ Jesus&emdash;</verse>
    <marker class="begin-verse" mid="v57001010"/>
    <verse num="10">I appeal to you for <crossref let="p" cid="c57001010.1"/>my child, <crossref let="q" cid="c57001010.2"/>Onesimus,<note nid="n57001010.1"/> <crossref let="r" cid="c57001010.3"/>whose father I became in my imprisonment.</verse>
    <marker class="begin-verse" mid="v57001011"/>
    <verse num="11">(Formerly he was useless to you, but now he is indeed useful to you and to me.)</verse>
    <marker class="begin-verse" mid="v57001012"/>
    <verse num="12">I am sending him back to you, sending my very heart.</verse>
    <marker class="begin-verse" mid="v57001013"/>
    <verse num="13">I would have been glad to keep him with me, in order that he might serve me <crossref let="s" cid="c57001013.1"/>on your behalf <crossref let="t" cid="c57001013.2"/>during my imprisonment for the gospel,</verse>
    <marker class="begin-verse" mid="v57001014"/>
    <verse num="14">but I preferred to do nothing without your consent in order that your goodness might not be <crossref let="u" cid="c57001014.1"/>by compulsion but of your own accord.</verse>
    <marker class="begin-verse" mid="v57001015"/>
    <verse num="15">For this perhaps is why <crossref let="v" cid="c57001015.1"/>he was parted from you for a while, that you might have him back forever,</verse>
    <marker class="begin-verse" mid="v57001016"/>
    <verse num="16"><crossref let="w" cid="c57001016.1"/>no longer as a bondservant<note nid="n57001016.1"/> but more than a bondservant, as <crossref let="x" cid="c57001016.2"/>a beloved brother&emdash;especially to me, but how much more to you, <crossref let="y" cid="c57001016.3"/>both in the flesh and in the Lord.</verse>
    <end-paragraph/>
    <marker class="begin-verse" mid="v57001017"/>
    <begin-paragraph/>
    <verse num="17">So if you consider me <crossref let="z" cid="c57001017.1"/>your partner, receive him as you would receive me.</verse>
    <marker class="begin-verse" mid="v57001018"/>
    <verse num="18">If he has wronged you at all, or owes you anything, charge that to my account.</verse>
    <marker class="begin-verse" mid="v57001019"/>
    <verse num="19"><crossref let="a" cid="c57001019.1"/>I, Paul, write this with my own hand: I will repay it&emdash;to say nothing of your owing me even your own self.</verse>
    <marker class="begin-verse" mid="v57001020"/>
    <verse num="20">Yes, brother, I want some benefit from you in the Lord. <crossref let="b" cid="c57001020.1"/>Refresh my heart in Christ.</verse>
    <end-paragraph/>
    <marker class="begin-verse" mid="v57001021"/>
    <begin-paragraph/>
    <verse num="21"><crossref let="c" cid="c57001021.1"/>Confident of your obedience, I write to you, knowing that you will do even more than I say.</verse>
    <marker class="begin-verse" mid="v57001022"/>
    <verse num="22">At the same time, prepare a guest room for me, for <crossref let="d" cid="c57001022.1"/>I am hoping that <crossref let="e" cid="c57001022.2"/>through your prayers <crossref let="f" cid="c57001022.3"/>I will be graciously given to you.</verse>
    <end-paragraph/>
    <marker class="begin-verse" mid="v57001023"/>
    <heading>Final Greetings</heading>
    <begin-paragraph/>
    <verse num="23"><crossref let="g" cid="c57001023.1"/>Epaphras, my <crossref let="h" cid="c57001023.2"/>fellow prisoner in Christ Jesus, sends greetings to you,</verse>
    <marker class="begin-verse" mid="v57001024"/>
    <verse num="24">and so do <crossref let="i" cid="c57001024.1"/>Mark, <crossref let="i" cid="c57001024.2"/>Aristarchus, <crossref let="j" cid="c57001024.3"/>Demas, and <crossref let="j" cid="c57001024.4"/>Luke, my fellow workers.</verse>
    <end-paragraph/>
    <marker class="begin-verse" mid="v57001025"/>
    <begin-paragraph/>
    <verse num="25"><crossref let="k" cid="c57001025.1"/>The grace of the Lord Jesus Christ be with your spirit.</verse>
    <end-paragraph/>
  </chapter>
</book>
</crossway-bible>
